{
  "schema_version": "1.1.0",
  "source_id": "SRC-SEOUL-SALES",
  "original_filename": "서울시 상권분석서비스(추정매출-상권)_2024년.zip",
  "raw_path": "raw/SRC-SEOUL-SALES/서울시 상권분석서비스(추정매출-상권)_2024년.zip",
  "extension": ".zip",
  "file_size": 14288976,
  "sha256": "97e7cde3a3291a8fd623f7b5268ea4b01a666027ae20da2ddf804ddae22288c5",
  "last_modified_at": "2026-08-28T08:15:01.799Z",
  "retrieved_at": null,
  "source_date": "2024-Q1..2024-Q4",
  "source_version": "2024_KO_HEADER",
  "is_zip": true,
  "inner_files": [
    {
      "original_filename": "서울시 상권분석서비스(추정매출-상권)_2024년.csv",
      "extension": ".csv",
      "compressed_size": 14288602,
      "uncompressed_size": 40356222,
      "compression_method": "DEFLATE",
      "crc32": "6fd79ed9",
      "filename_encoding": "CP949",
      "last_modified_local": "2025-06-04T16:29:36"
    }
  ],
  "encoding": "CP949",
  "header": [
    "기준_년분기_코드",
    "상권_구분_코드",
    "상권_구분_코드_명",
    "상권_코드",
    "상권_코드_명",
    "서비스_업종_코드",
    "서비스_업종_코드_명",
    "당월_매출_금액",
    "당월_매출_건수",
    "주중_매출_금액",
    "주말_매출_금액",
    "월요일_매출_금액",
    "화요일_매출_금액",
    "수요일_매출_금액",
    "목요일_매출_금액",
    "금요일_매출_금액",
    "토요일_매출_금액",
    "일요일_매출_금액",
    "시간대_00~06_매출_금액",
    "시간대_06~11_매출_금액",
    "시간대_11~14_매출_금액",
    "시간대_14~17_매출_금액",
    "시간대_17~21_매출_금액",
    "시간대_21~24_매출_금액",
    "남성_매출_금액",
    "여성_매출_금액",
    "연령대_10_매출_금액",
    "연령대_20_매출_금액",
    "연령대_30_매출_금액",
    "연령대_40_매출_금액",
    "연령대_50_매출_금액",
    "연령대_60_이상_매출_금액",
    "주중_매출_건수",
    "주말_매출_건수",
    "월요일_매출_건수",
    "화요일_매출_건수",
    "수요일_매출_건수",
    "목요일_매출_건수",
    "금요일_매출_건수",
    "토요일_매출_건수",
    "일요일_매출_건수",
    "시간대_건수~06_매출_건수",
    "시간대_건수~11_매출_건수",
    "시간대_건수~14_매출_건수",
    "시간대_건수~17_매출_건수",
    "시간대_건수~21_매출_건수",
    "시간대_건수~24_매출_건수",
    "남성_매출_건수",
    "여성_매출_건수",
    "연령대_10_매출_건수",
    "연령대_20_매출_건수",
    "연령대_30_매출_건수",
    "연령대_40_매출_건수",
    "연령대_50_매출_건수",
    "연령대_60_이상_매출_건수"
  ],
  "row_count": 87179,
  "key_field": "상권_코드",
  "key_count": 1581,
  "row_key_fields": [
    "기준_년분기_코드",
    "상권_구분_코드",
    "상권_코드",
    "서비스_업종_코드"
  ],
  "null_key_count": 0,
  "duplicate_key_count": 0,
  "content_validation_status": "VALIDATED",
  "validation_status": "NEEDS_REVIEW",
  "compatibility_status": "NEEDS_REVIEW",
  "normalized_output": null,
  "notes": "Raw bytes preserved. Header·row key·상권코드 집합만 검증했으며 매출 금액 합계·평균은 계산하지 않았다."
}
