{
  "schema_version": "1.1.0",
  "source_id": "SRC-SEOUL-LIVING",
  "original_filename": "250_LOCAL_RESD_20260823.zip",
  "raw_path": "raw/SRC-SEOUL-LIVING/250_LOCAL_RESD_20260823.zip",
  "extension": ".zip",
  "file_size": 14921404,
  "sha256": "f8040e04b1da4bcf68eaac6171cd8ab242e88ca8a579370ff0a5e962ace8f362",
  "last_modified_at": "2026-08-28T08:15:17.285Z",
  "retrieved_at": null,
  "source_date": "2026-08-23",
  "source_version": "20260823_KO_HEADER",
  "is_zip": true,
  "inner_files": [
    {
      "original_filename": "250_LOCAL_RESD_20260823.csv",
      "extension": ".csv",
      "compressed_size": 14921236,
      "uncompressed_size": 58434291,
      "compression_method": "DEFLATE",
      "crc32": "c77de7af",
      "filename_encoding": "UTF-8",
      "last_modified_local": "2026-08-27T14:21:32"
    }
  ],
  "encoding": "CP949",
  "header": [
    "일자",
    "시간",
    "행정동코드",
    "250M격자",
    "생활인구합계",
    "남자 0~9세",
    "남자 10~14세",
    "남자 15~19세",
    "남자 20~24세",
    "남자 25~29세",
    "남자 30~34세",
    "남자 35~39세",
    "남자 40~44세",
    "남자 45~49세",
    "남자 50~54세",
    "남자 55~59세",
    "남자 60~64세",
    "남자 65~69세",
    "남자 70세 이상",
    "여자 0~9세",
    "여자 10~14세",
    "여자 15~19세",
    "여자 20~24세",
    "여자 25~29세",
    "여자 30~34세",
    "여자 35~39세",
    "여자 40~44세",
    "여자 45~49세",
    "여자 50~54세",
    "여자 55~59세",
    "여자 60~64세",
    "여자 65~69세",
    "여자 70세 이상"
  ],
  "row_count": 253686,
  "key_field": "250M격자",
  "key_count": 8564,
  "row_key_fields": [
    "일자",
    "시간",
    "행정동코드",
    "250M격자"
  ],
  "null_key_count": 0,
  "duplicate_key_count": 0,
  "content_validation_status": "NEEDS_REVIEW",
  "validation_status": "NEEDS_REVIEW",
  "compatibility_status": "NEEDS_REVIEW",
  "normalized_output": null,
  "notes": "Raw bytes preserved. 250M격자 coverage만 계산했으며 '*' 억제값과 행정동별 grid 분할을 기록했다. 생활인구 합산 및 Market 집계는 수행하지 않았다."
}
